{
    "contact_city": "Loa Janan, Samarinda",
    "contact_street": "Jalan Jati 7, Harapan Baru",
    "contact_phone": "+6282130832808",
    "contact_availableToPhone" : "Mon to Fri 9am to 6pm",
    "contact_email": "admin@jatifitness.com",
    "contact_emailMessage": "Send us your query anytime!",
    "contact_facebook_url": "#",
    "contact_tiktok_url": "#", 
    "contact_instagram_url": "https://www.instagram.com/fitjati/"   
}